{
  "$schema": "https://json-schema.org/draft/2020-12/schema",
  "$id": "urn:aces-scenario-pack:schema:pack-metadata:v0",
  "version": "0.1.0",
  "title": "ACES Scenario Pack — Pack Metadata (v0)",
  "description": "Manifest metadata for an ACES scenario pack: identity, version, targeted ACES SDL contract version, scenario references, lifecycle state, and declared optional layers. Implements the Minimum Pack Shape in contracts/scenario-pack-contract.md and does not redefine SDL semantics.",
  "type": "object",
  "required": ["packId", "name", "version", "sdlContractVersion", "lifecycleState", "scenarios"],
  "properties": {
    "packId": {"type": "string", "description": "Stable, ACES-native pack identifier."},
    "name": {"type": "string", "description": "Human-readable pack name."},
    "version": {"type": "string", "description": "Pack version using SemVer per docs/versioning.md."},
    "sdlContractVersion": {"type": "string", "description": "ACES SDL contract version this pack targets. SDL semantics are owned by ACES core."},
    "lifecycleState": {
      "type": "string",
      "enum": ["Draft", "Candidate", "Published", "Deprecated", "Withdrawn"],
      "description": "Current pack lifecycle state from the contract's ACES-native set."
    },
    "scenarios": {
      "type": "array",
      "minItems": 1,
      "description": "One or more SDL scenario references carried by the pack. A pack with no scenarios is not a scenario pack.",
      "items": {
        "type": "object",
        "required": ["scenarioId", "sdlRef"],
        "properties": {
          "scenarioId": {"type": "string", "description": "Pack-local identifier for the scenario."},
          "sdlRef": {"type": "string", "description": "Reference to the SDL scenario definition carried by the pack."}
        }
      }
    },
    "layers": {
      "type": "array",
      "description": "Declared optional layers. Each references a capability and the schema version that owns its detail, so layer schemas can add detail without rewriting this base schema.",
      "items": {
        "type": "object",
        "required": ["name", "provided"],
        "properties": {
          "name": {"type": "string", "description": "Optional-layer name as declared by the contract."},
          "provided": {"type": "boolean", "description": "Whether the pack provides this layer."},
          "schemaId": {"type": "string", "description": "Schema id that owns this layer's detail (see schemas/index.json)."},
          "schemaVersion": {"type": "string", "description": "Version of the layer schema this pack targets."}
        }
      }
    }
  }
}
