{
  "packId": "aces-example-pack",
  "name": "ACES Example Scenario Pack",
  "version": "0.1.0",
  "sdlContractVersion": "0",
  "lifecycleState": "Draft",
  "scenarios": [
    {"scenarioId": "example-scenario", "sdlRef": "scenarios/example-scenario"}
  ],
  "layers": [
    {"name": "Oracle and Scoring", "provided": false},
    {"name": "Proof", "provided": false},
    {"name": "Challenge and Flag Adapter", "provided": false},
    {"name": "Delivery and Audience Bundle", "provided": false}
  ]
}
